,PMID,Publication_Title
0,34942634,Evolution of enhanced innate immune evasion by SARS-CoV-2
1,35085183,Higher Proinflammatory Cytokines Are Associated With Increased Antibody Titer After a Third Dose of SARS-CoV-2 Vaccine in Solid Organ Transplant Recipients
2,35148837,"Immune imprinting, breadth of variant recognition, and germinal center response in human SARS-CoV-2 infection and vaccination"
3,35150638,Mutations in SARS-CoV-2 variants of concern link to increased spike cleavage and virus transmission
4,35169798,Vaccine Protection Against the SARS-CoV-2 Omicron Variant in Macaques
5,35169817,Comparable Neutralization of the SARS-CoV-2 Omicron BA.1 and BA.2 Variants
6,35175842,"A Scientific Imperative as Seen Through a Sharpened Lens: Sex, Gender, and the Cardiovascular Condition"
